{
  "schemaVersion": "uc-evidence-expansion-1.1.0",
  "runId": "uc-exp-c1923c4807f4",
  "runStartTime": "2026-09-02T13:08:34Z",
  "runFinishTime": "2026-10-23T18:10:12Z",
  "lastCheckpointTime": "2026-10-23T18:10:12Z",
  "runStatus": "completed",
  "currentTopicId": "T-UCX-03",
  "currentSearchStrategyId": null,
  "currentSearchQuery": null,
  "currentApiCursor": 0,
  "lastProcessedRecord": "0 screened this run",
  "latestPublicationTimestampEncountered": "2017-10-06",
  "completedSearches": [
    {
      "searchId": "S-UCX-01-a",
      "service": "WebSearch",
      "query": "AGA Clinical Practice Guidelines role of biomarkers management ulcerative colitis 2023 fecal calprotectin PubMed",
      "resultsScreened": 6,
      "eligibleNew": 1,
      "executedAt": "2026-09-02T13:09:10Z"
    },
    {
      "searchId": "S-UCX-02-a",
      "service": "WebSearch",
      "query": "STRIDE-II treat to target ulcerative colitis targets fecal calprotectin endoscopic remission Gastroenterology 2021",
      "resultsScreened": 6,
      "eligibleNew": 1,
      "executedAt": "2026-09-02T13:09:20Z"
    },
    {
      "searchId": "S-UCX-01-b",
      "service": "EuropePMC/keyword",
      "query": "ulcerative colitis fecal calprotectin endoscopic remission meta-analysis AND OPEN_ACCESS:y (sort CITED desc)",
      "resultsScreened": 12,
      "eligibleNew": 0,
      "executedAt": "2026-09-02T13:11:00Z",
      "note": "Relevance drift to microbiome topics; no eligible new monitoring source; not retried further."
    },
    {
      "searchId": "S-UCX-01-c",
      "service": "EuropePMC/id-lookup",
      "query": "EXT_ID lookups: 33359090, 36822736, 30840605, 34635919, 31945371, 32044313",
      "resultsScreened": 6,
      "eligibleNew": 2,
      "executedAt": "2026-09-02T13:11:30Z",
      "note": "Direct identifier retrieval for candidate guideline citations (not keyword discovery)."
    },
    {
      "searchId": "auto-ea42e7-0",
      "service": "europepmc",
      "query": "acute severe ulcerative colitis Truelove Witts criteria hospitalization urgent assessment",
      "resultsScreened": 0,
      "executedAt": "2026-09-04T22:39:55Z"
    },
    {
      "searchId": "auto-ea42e7-1",
      "service": "europepmc",
      "query": "full-text ASUC section of ACG UC guideline 2019 (PMID 30840605) / AGA hospitalized UC guidance",
      "resultsScreened": 0,
      "executedAt": "2026-09-04T22:39:55Z"
    },
    {
      "searchId": "auto-28a130-0",
      "service": "europepmc",
      "query": "acute severe ulcerative colitis Truelove Witts criteria hospitalization urgent assessment",
      "resultsScreened": 0,
      "executedAt": "2026-09-05T16:37:29Z"
    },
    {
      "searchId": "auto-60c118-0",
      "service": "europepmc",
      "query": "acute severe ulcerative colitis Truelove Witts criteria hospitalization urgent assessment",
      "resultsScreened": 0,
      "executedAt": "2026-09-06T16:45:44Z"
    },
    {
      "searchId": "auto-03457a-0",
      "service": "europepmc",
      "query": "acute severe ulcerative colitis Truelove Witts criteria hospitalization urgent assessment",
      "resultsScreened": 0,
      "executedAt": "2026-09-07T18:38:45Z"
    },
    {
      "searchId": "auto-145d88-0",
      "service": "europepmc",
      "query": "ulcerative colitis AND (acute severe OR calprotectin OR treat to target) AND (guideline OR consensus OR randomized) AND (2021:2026[pub_year])",
      "resultsScreened": 0,
      "executedAt": "2026-09-08T17:48:55Z"
    },
    {
      "searchId": "auto-ed4757-0",
      "service": "europepmc",
      "query": "ulcerative colitis AND (acute severe OR calprotectin OR treat to target) AND (guideline OR consensus OR randomized) AND (2021:2026[pub_year])",
      "resultsScreened": 0,
      "executedAt": "2026-09-09T17:40:50Z"
    },
    {
      "searchId": "auto-4ba938-0",
      "service": "europepmc",
      "query": "ulcerative colitis AND (acute severe OR calprotectin OR treat to target) AND (guideline OR consensus OR randomized) AND (2021:2026[pub_year])",
      "resultsScreened": 0,
      "executedAt": "2026-09-10T17:32:44Z"
    },
    {
      "searchId": "auto-434ec0-0",
      "service": "europepmc",
      "query": "ulcerative colitis AND (acute severe OR calprotectin OR treat to target) AND (guideline OR consensus OR randomized) AND (2021:2026[pub_year])",
      "resultsScreened": 0,
      "executedAt": "2026-09-11T17:37:56Z"
    },
    {
      "searchId": "auto-7474b2-0",
      "service": "europepmc",
      "query": "ulcerative colitis AND (acute severe OR calprotectin OR treat to target) AND (guideline OR consensus OR randomized) AND (2021:2026[pub_year])",
      "resultsScreened": 0,
      "executedAt": "2026-09-12T16:49:22Z"
    },
    {
      "searchId": "auto-cc96c7-0",
      "service": "europepmc",
      "query": "ulcerative colitis AND (acute severe OR calprotectin OR treat to target) AND (guideline OR consensus OR randomized) AND (2021:2026[pub_year])",
      "resultsScreened": 0,
      "executedAt": "2026-09-13T17:19:46Z"
    },
    {
      "searchId": "auto-b5bdd9-0",
      "service": "europepmc",
      "query": "ulcerative colitis AND (acute severe OR calprotectin OR treat to target) AND (guideline OR consensus OR randomized) AND (2021:2026[pub_year])",
      "resultsScreened": 0,
      "executedAt": "2026-09-14T19:05:24Z"
    },
    {
      "searchId": "auto-74e1d8-0",
      "service": "europepmc",
      "query": "ulcerative colitis AND (acute severe OR calprotectin OR treat to target) AND (guideline OR consensus OR randomized) AND (2021:2026[pub_year])",
      "resultsScreened": 0,
      "executedAt": "2026-09-15T18:01:09Z"
    },
    {
      "searchId": "auto-0a09a2-0",
      "service": "europepmc",
      "query": "ulcerative colitis AND (acute severe OR calprotectin OR treat to target) AND (guideline OR consensus OR randomized) AND (2021:2026[pub_year])",
      "resultsScreened": 0,
      "executedAt": "2026-09-16T18:00:41Z"
    },
    {
      "searchId": "auto-3de0cf-0",
      "service": "europepmc",
      "query": "ulcerative colitis AND (acute severe OR calprotectin OR treat to target) AND (guideline OR consensus OR randomized) AND (2021:2026[pub_year])",
      "resultsScreened": 0,
      "executedAt": "2026-09-17T17:59:39Z"
    },
    {
      "searchId": "auto-512d54-0",
      "service": "europepmc",
      "query": "ulcerative colitis AND (acute severe OR calprotectin OR treat to target) AND (guideline OR consensus OR randomized) AND (2021:2026[pub_year])",
      "resultsScreened": 0,
      "executedAt": "2026-09-18T17:34:35Z"
    },
    {
      "searchId": "auto-3c07d4-0",
      "service": "europepmc",
      "query": "ulcerative colitis AND (acute severe OR calprotectin OR treat to target) AND (guideline OR consensus OR randomized) AND (2021:2026[pub_year])",
      "resultsScreened": 0,
      "executedAt": "2026-09-19T17:03:08Z"
    },
    {
      "searchId": "auto-ef8c73-0",
      "service": "europepmc",
      "query": "ulcerative colitis AND (acute severe OR calprotectin OR treat to target) AND (guideline OR consensus OR randomized) AND (2021:2026[pub_year])",
      "resultsScreened": 0,
      "executedAt": "2026-09-20T17:20:13Z"
    },
    {
      "searchId": "auto-eab6eb-0",
      "service": "europepmc",
      "query": "ulcerative colitis AND (acute severe OR calprotectin OR treat to target) AND (guideline OR consensus OR randomized) AND (2021:2026[pub_year])",
      "resultsScreened": 0,
      "executedAt": "2026-09-21T19:07:53Z"
    },
    {
      "searchId": "auto-63f0f8-0",
      "service": "europepmc",
      "query": "ulcerative colitis AND (acute severe OR calprotectin OR treat to target) AND (guideline OR consensus OR randomized) AND (2021:2026[pub_year])",
      "resultsScreened": 0,
      "executedAt": "2026-09-22T17:59:25Z"
    },
    {
      "searchId": "auto-d67fae-0",
      "service": "europepmc",
      "query": "ulcerative colitis AND (acute severe OR calprotectin OR treat to target) AND (guideline OR consensus OR randomized) AND (2021:2026[pub_year])",
      "resultsScreened": 0,
      "executedAt": "2026-09-23T18:18:21Z"
    },
    {
      "searchId": "auto-118ac4-0",
      "service": "europepmc",
      "query": "ulcerative colitis AND (acute severe OR calprotectin OR treat to target) AND (guideline OR consensus OR randomized) AND (2021:2026[pub_year])",
      "resultsScreened": 0,
      "executedAt": "2026-09-24T18:19:02Z"
    },
    {
      "searchId": "auto-5b507c-0",
      "service": "europepmc",
      "query": "ulcerative colitis AND (acute severe OR calprotectin OR treat to target) AND (guideline OR consensus OR randomized) AND (2021:2026[pub_year])",
      "resultsScreened": 0,
      "executedAt": "2026-09-25T18:18:34Z"
    },
    {
      "searchId": "auto-660931-0",
      "service": "europepmc",
      "query": "ulcerative colitis AND (acute severe OR calprotectin OR treat to target) AND (guideline OR consensus OR randomized) AND (2021:2026[pub_year])",
      "resultsScreened": 0,
      "executedAt": "2026-09-26T17:39:06Z"
    },
    {
      "searchId": "auto-1d0f5c-0",
      "service": "europepmc",
      "query": "ulcerative colitis AND (acute severe OR calprotectin OR treat to target) AND (guideline OR consensus OR randomized) AND (2021:2026[pub_year])",
      "resultsScreened": 0,
      "executedAt": "2026-09-27T18:06:30Z"
    },
    {
      "searchId": "auto-5260a4-0",
      "service": "europepmc",
      "query": "ulcerative colitis AND (acute severe OR calprotectin OR treat to target) AND (guideline OR consensus OR randomized) AND (2021:2026[pub_year])",
      "resultsScreened": 0,
      "executedAt": "2026-09-28T20:25:17Z"
    },
    {
      "searchId": "auto-ac702c-0",
      "service": "europepmc",
      "query": "ulcerative colitis AND (acute severe OR calprotectin OR treat to target) AND (guideline OR consensus OR randomized) AND (2021:2026[pub_year])",
      "resultsScreened": 0,
      "executedAt": "2026-09-29T19:11:44Z"
    },
    {